"id","created","modified","task_id","scene_id","entity_id","answer","object_description","location_description","use_in_object_tasks"
"1300","2012-12-07 05:50:49.957013+0000","2013-02-12 23:44:34.957180+0000","260","1","1","","a purple rectangular prism","near the far edge of the table and directly above an orange rectangular prism","f"
"1301","2012-12-07 05:52:22.607825+0000","2013-02-12 23:44:34.964400+0000","261","2","7","","the green box all the way in the back of the table.","the smallest one.","f"
"1302","2012-12-07 05:52:22.613505+0000","2013-02-12 23:44:34.980652+0000","261","1","3","","the first rectangle from the front of the table.","orange.","f"
"1303","2012-12-07 05:52:22.617640+0000","2013-02-12 23:45:25.668883+0000","261","2","6","","the smallest purple box","the third box from the front","f"
"1304","2012-12-07 05:52:22.621883+0000","2013-02-12 23:45:25.684813+0000","261","2","10","","the yellow box","second box from the back of the table.","f"
"1305","2012-12-07 05:52:22.625983+0000","2013-02-12 23:45:25.691611+0000","261","5","25","","the biggest sphere","yellow.","f"
"1306","2012-12-07 06:22:43.202497+0000","2013-02-12 23:45:25.698258+0000","262","3","13","","a cylinder","placed at the end of the table","f"
"1307","2012-12-07 06:22:43.220403+0000","2013-02-12 23:44:17.303727+0000","262","1","3","","Rectangular Prism ","placed  infront of the cylindrical cube","f"
"1308","2012-12-07 06:22:43.225267+0000","2013-02-12 23:45:25.708804+0000","262","5","23","","Rectangular Prism ","place at the end of the table ","f"
"1309","2012-12-07 06:22:43.231363+0000","2013-02-12 23:45:25.718922+0000","262","2","8","","Rectangular Prism ","Places at the middle of the table ","f"
"1310","2012-12-07 06:22:43.236402+0000","2013-02-12 23:45:25.726236+0000","262","2","9",""," a Rectangular Prism ","at the corner of the table ","f"
"1311","2012-12-07 06:36:03.381430+0000","2013-02-12 23:45:25.733335+0000","263","3","11","","a rectangular orange block","positioned on the right-hand side of the table about halfway up the length, away from the other objects.","f"
"1312","2012-12-07 06:36:03.389477+0000","2013-02-12 23:45:25.745577+0000","263","1","1","","a dark purple slightly rectangular box","the furthest object away and sits on the right hand side of the table, near the edge.","f"
"1313","2012-12-07 06:36:03.394567+0000","2013-02-12 23:45:25.753283+0000","263","2","8","","a dark purple, slightly rectangular box ","the object that is closest to the center of the table.","f"
"1314","2012-12-07 06:36:03.400156+0000","2013-02-12 23:44:17.315272+0000","263","2","6","","a dark purple square box whose sides are narrower than its top and bottom if it were lying flat","a little more than halfway toward the back end of the table, on the left hand side near the edge.","f"
"1315","2012-12-07 06:36:03.404643+0000","2013-02-12 23:45:25.761302+0000","263","2","10","","an odd shade of green, sort of between lime and pea green, and is square in shape","the second to last item on the end of the table furthest from our viewpoint.","f"
"1316","2012-12-07 07:10:47.957425+0000","2013-02-12 23:45:25.768129+0000","264","3","14","","a small blue cylander","to the left of the green rectangle","f"
"1317","2012-12-07 07:10:48.283053+0000","2013-02-12 23:45:25.775077+0000","264","3","11","","a tall orange rectangle","the shape on the lower right","f"
"1318","2012-12-07 07:10:48.287641+0000","2013-02-12 23:45:25.782859+0000","264","5","22","","a purple cube","not near any other shapes","f"
"1319","2012-12-07 07:10:48.293670+0000","2013-02-12 23:45:25.790259+0000","264","1","4","","an orange cylander","next to the blue ball","f"
"1320","2012-12-07 07:10:48.298754+0000","2013-02-12 23:45:25.796807+0000","264","5","25","","a yellow ball","near the blue cube","f"
"1321","2012-12-07 07:20:21.621813+0000","2013-02-12 23:45:25.803575+0000","265","3","14","","blue","no","f"
"1322","2012-12-07 07:20:21.630031+0000","2013-02-12 23:45:25.810374+0000","265","4","17","","yellow","yes","f"
"1323","2012-12-07 07:20:21.645008+0000","2013-02-12 23:44:35.056817+0000","265","5","23","","blue","yes","f"
"1324","2012-12-07 07:20:21.656032+0000","2013-02-12 23:44:35.939777+0000","265","2","6","","pink","no","f"
"1325","2012-12-07 07:20:21.671492+0000","2013-02-12 23:44:35.952608+0000","265","2","8","","pink","yes","f"
"1326","2012-12-07 08:06:28.181691+0000","2013-02-12 23:44:17.323626+0000","266","1","3","","a brown colored cuboid.","placed between brown colored cylinder and pink colored cuboid. ","f"
"1327","2012-12-07 08:06:28.189367+0000","2013-02-12 23:45:25.831727+0000","266","3","12","","a green colored cuboid","placed just to the right of the blue colored cylinder.","f"
"1328","2012-12-07 08:06:28.194532+0000","2013-02-12 23:45:25.838372+0000","266","4","19","","a brown colored cylinder","placed just to the left of the red colored cylinder.","f"
"1329","2012-12-07 08:06:28.199441+0000","2013-02-12 23:44:35.073693+0000","266","3","14","","brown colored cylinder","placed just to the left of a red colored sphere.","f"
"1330","2012-12-07 08:06:28.203796+0000","2013-02-12 23:44:35.088396+0000","266","4","16","","a yellow colored cuboid","placed behind red colored sphere.","f"
"1331","2012-12-07 08:55:58.787403+0000","2013-02-12 23:44:35.104665+0000","267","3","14","","blue cylinder","left side of green block","f"
"1332","2012-12-07 08:55:58.800303+0000","2013-02-12 23:44:35.914098+0000","267","4","17","","yellow rectangular prism","in front of the red sphere ","t"
"1333","2012-12-07 08:55:58.805284+0000","2013-02-12 23:44:35.122982+0000","267","5","21","","green block","left side of the violet sphere","f"
"1334","2012-12-07 08:55:58.811841+0000","2013-02-12 23:44:35.131362+0000","267","4","16","","yellow block","middle fo the table","f"
"1335","2012-12-07 08:55:58.816370+0000","2013-02-12 23:44:35.141075+0000","267","2","9","","violet cube","nearest left corner","f"
"1336","2012-12-07 08:58:28.431183+0000","2013-02-12 23:44:35.152708+0000","268","2","7","","at the far end of the table","a green cube","f"
"1337","2012-12-07 08:58:28.439223+0000","2013-02-12 23:44:35.165998+0000","268","4","17","","closest to the viewer","yellow rectangular prism","f"
"1338","2012-12-07 08:58:28.444957+0000","2013-02-12 23:44:35.184006+0000","268","1","1","","farthest from the viewer","a purple cube","f"
"1339","2012-12-07 08:58:28.449892+0000","2013-02-12 23:44:35.194680+0000","268","3","13","","at the far left of the viewer","a brown cylinder","f"
"1340","2012-12-07 08:58:28.455640+0000","2013-02-12 23:44:35.220813+0000","268","4","18","","farthest from the viewer","a green cube","f"
"1341","2012-12-07 09:19:33.168832+0000","2013-02-12 23:44:35.234600+0000","269","2","6","","a purple cube, second smallest of all.","at top left of the table.","f"
"1342","2012-12-07 09:19:33.176123+0000","2013-02-12 23:44:35.260272+0000","269","4","18","","a green cube, smallest of the objects.","closest to far edge of table.","f"
"1343","2012-12-07 09:19:33.182951+0000","2013-02-12 23:44:35.270125+0000","269","3","13","","a orange cylinder.","closest to top left corner than all of them.","f"
"1344","2012-12-07 09:19:33.187839+0000","2013-02-12 23:44:35.277546+0000","269","3","11","","a orange cube.","closest object to near end of table.","f"
"1345","2012-12-07 09:19:33.193976+0000","2013-02-12 23:44:35.286649+0000","269","2","10","","only yellow cube.","at top left of table.","f"
"1346","2012-12-07 09:21:22.792594+0000","2013-02-12 23:44:35.295494+0000","270","5","24","","top surface of the table","top","f"
"1347","2012-12-07 09:21:22.799306+0000","2013-02-12 23:44:35.304197+0000","270","4","16","","rectangle","on the left side of the table corner","f"
"1348","2012-12-07 09:21:22.803554+0000","2013-02-12 23:44:35.311669+0000","270","1","3","","rectangle","on the very left side of the table corner","f"
"1349","2012-12-07 09:21:22.808766+0000","2013-02-12 23:44:35.323272+0000","270","2","8","","rectangle","on the left side of the table corner","f"
"1350","2012-12-07 09:21:22.814176+0000","2013-02-12 23:44:35.336088+0000","270","2","10","","square","on the right side of the table corner","f"
"1351","2012-12-07 09:28:58.380065+0000","2013-02-12 23:44:35.347649+0000","271","5","24","","a small purple ball","about an inch to the right of a green cube","f"
"1352","2012-12-07 09:28:58.387350+0000","2013-02-12 23:44:35.355577+0000","271","4","17","","a yellow box, more wide than tall, standing vertically","the object furthest south on the table","f"
"1353","2012-12-07 09:28:58.392146+0000","2013-02-12 23:44:35.362710+0000","271","1","1","","a purple box, taller than it is wide","the northernmost object on the table","f"
"1354","2012-12-07 09:28:58.396753+0000","2013-02-12 23:44:35.370261+0000","271","5","23","","a blue box, taller than it is wide","the northernmost object on the table","f"
"1355","2012-12-07 09:28:58.401187+0000","2013-02-12 23:44:35.391889+0000","271","3","15","","a green three-d oval","the northernmost object on the table","f"
"1356","2012-12-07 09:49:20.288335+0000","2013-02-12 23:44:35.405020+0000","272","3","12","","a green colored rectangular body","object next to blue colored circle on its left","f"
"1357","2012-12-07 09:49:20.296903+0000","2013-02-12 23:44:35.416417+0000","272","4","20","","a red ball","object with an orange disc on left and two yellow rectangular boxes at top and bottom","f"
"1358","2012-12-07 09:49:20.312533+0000","2013-02-12 23:44:35.431785+0000","272","1","5","","Blue Ball","next to orange circular disc","f"
"1359","2012-12-07 09:49:20.329468+0000","2013-02-12 23:44:35.439109+0000","272","5","21","","Green Reactangle","just loctaedon the left side of purple ball","f"
"1360","2012-12-07 09:49:20.336718+0000","2013-02-12 23:44:35.454042+0000","272","3","13","","Orange circular disc","just above blue circular disc","f"
"1361","2012-12-07 10:34:04.161278+0000","2013-02-12 23:44:35.465227+0000","273","1","2","","the pink rectangle","second farthest from the back of the table, in between a purple and orange rectangle.","f"
"1362","2012-12-07 10:34:04.169079+0000","2013-02-12 23:44:35.475404+0000","273","1","3","","the orange rectangle","in the middle of the other four objects and closest to the pink rectangle and the orange cylinder.","f"
"1363","2012-12-07 10:34:04.173582+0000","2013-02-12 23:44:35.487948+0000","273","1","4","","the orange cylinder","in the middle of the table and is the second closest object ","f"
"1364","2012-12-07 10:34:04.177893+0000","2013-02-12 23:44:35.497924+0000","273","5","23","","the blue square","at the very back edge of the table, behind the other four objects.","f"
"1365","2012-12-07 10:34:04.183037+0000","2013-02-12 23:44:35.508472+0000","273","4","18","","the green square","is behind the other fours object, but not quite at the back edge of the table.","f"
"1366","2012-12-07 10:45:08.747958+0000","2013-02-12 23:44:35.515878+0000","274","3","13","","a brown colored round shaped oblect","towardsthe north- west side of the table","f"
"1367","2012-12-07 10:45:08.760192+0000","2013-02-12 23:44:35.541546+0000","274","5","23","","a blue colored square block","towards the north side of the table","f"
"1368","2012-12-07 10:45:08.765223+0000","2013-02-12 23:45:21.692621+0000","274","2","10","","a yellow colored block","towards the north west side of the table","t"
"1369","2012-12-07 10:45:08.777992+0000","2013-02-12 23:44:35.560362+0000","274","4","17","","a yellow colored rectangle","towards the south center of the table","f"
"1370","2012-12-07 10:45:08.785603+0000","2013-02-12 23:44:35.605931+0000","274","5","25","","yellow colored round shaped object","towards the north side of the table","f"
"1371","2012-12-07 11:13:59.588463+0000","2013-02-12 23:44:35.647813+0000","275","3","14","","the object two is in  small round cylindre in shape","located just away from the object four & towards left side of the table","f"
"1372","2012-12-07 11:13:59.712643+0000","2013-02-12 23:44:35.660231+0000","275","1","1","","a long rectangular in shape","locate far away from object one and nearer to the right side edge of the table","f"
"1373","2012-12-07 11:13:59.717424+0000","2013-02-12 23:44:35.676226+0000","275","4","18","","in a square shape","located nearer to the object five exactly a few centimeter away from the right side corner of the table","f"
"1374","2012-12-07 11:13:59.723995+0000","2013-02-12 23:44:35.718429+0000","275","5","24","","in shape like small ball or in a round  shape","located in the middle of the table & very close to object five","f"
"1375","2012-12-07 11:13:59.730847+0000","2013-02-12 23:44:35.754381+0000","275","1","5","","looks like a medium ball and in a globe shape ","located just away from the mid line of the table& very close to the object two","f"
"1376","2012-12-07 11:24:00.776334+0000","2013-02-12 23:44:35.775769+0000","276","5","21","","green in colour.It is a square shape.It is in the middle of the table.","this object placed","f"
"1377","2012-12-07 11:24:00.784245+0000","2013-02-12 23:44:35.842297+0000","276","2","6","","object is in the left corner","purple in colour","f"
"1378","2012-12-07 11:24:00.789424+0000","2013-02-12 23:44:35.858550+0000","276","4","16","","in the middle of the table.","it's colour is yellow.","f"
"1379","2012-12-07 11:24:00.794864+0000","2013-02-12 23:44:35.877069+0000","276","3","14","","a small object in this table.","dark blue in colour","f"
"1380","2012-12-07 11:24:00.803084+0000","2013-02-12 23:44:35.894697+0000","276","3","12","","near the blue shape.","it's colour is green.","f"
"1381","2012-12-07 11:29:39.936054+0000","2013-02-12 23:45:22.794949+0000","277","4","19","","cylinder","liftside","f"
"1382","2012-12-07 11:29:39.962190+0000","2013-02-12 23:44:36.710832+0000","277","3","15","","cylinder","right side","f"
"1383","2012-12-07 11:29:39.968304+0000","2013-02-12 23:44:35.961734+0000","277","2","6","","cube","left side","f"
"1384","2012-12-07 11:29:39.973541+0000","2013-02-12 23:44:35.971039+0000","277","3","11","","squre","right side","f"
"1385","2012-12-07 11:29:39.978360+0000","2013-02-12 23:44:35.984131+0000","277","4","20","","round","middle ","f"
"1386","2012-12-07 11:37:04.836921+0000","2013-02-12 23:44:35.993386+0000","278","2","9","","A purple cube with a black facet","In foreground in front of all of the other four objects","f"
"1387","2012-12-07 11:37:04.861383+0000","2013-02-12 23:44:36.001950+0000","278","3","11","","An orange rectangular prism","In front of the other objects and to the right of them","f"
"1388","2012-12-07 11:37:04.872667+0000","2013-02-12 23:45:22.802986+0000","278","1","3","","An orange rectangular prism","In line in between the other objects but slightly shifted to the right","f"
"1389","2012-12-07 11:37:04.892894+0000","2013-02-12 23:44:36.011321+0000","278","3","12","","A green rectangular prism","In the middle of the other objects in terms of back to front alignement. More to the left with proportion to the table","f"
"1390","2012-12-07 11:37:04.958008+0000","2013-02-12 23:44:36.023941+0000","278","3","13","","an orange cylinder","At the back left of the table","f"
"1391","2012-12-07 11:38:44.280015+0000","2013-02-12 23:44:36.032851+0000","279","4","20","","oblong","greenish yellow","f"
"1392","2012-12-07 11:38:44.286914+0000","2013-02-12 23:44:36.040069+0000","279","4","17","","hinge like","rough edges","f"
"1393","2012-12-07 11:38:44.291741+0000","2013-02-12 23:44:36.047368+0000","279","5","24","","blue","almost a square but onlong","f"
"1394","2012-12-07 11:38:44.296227+0000","2013-02-12 23:44:36.054512+0000","279","1","2","","ugly color","looks like a hinge","f"
"1395","2012-12-07 11:38:44.300705+0000","2013-02-12 23:44:36.061292+0000","279","5","25","","lovely green","quite like an egg shape","f"
"1396","2012-12-07 11:47:50.595995+0000","2013-02-12 23:44:36.070017+0000","280","1","4","","short cylinder","standing","f"
"1397","2012-12-07 11:47:50.603920+0000","2013-02-12 23:44:36.076757+0000","280","1","3","","block","standing","f"
"1398","2012-12-07 11:47:50.608917+0000","2013-02-12 23:44:36.083280+0000","280","5","22","","cube","standing","f"
"1399","2012-12-07 11:47:50.615346+0000","2013-02-12 23:44:36.090197+0000","280","5","21","","rectangular dube","lyind","f"
"1400","2012-12-07 11:47:50.620023+0000","2013-02-12 23:44:36.096656+0000","280","4","17","","rectangular block","lying on the side","f"
"1401","2012-12-07 11:57:58.432588+0000","2013-02-12 23:44:36.113479+0000","281","5","21","","a green rectangular object ","towards the far end but away from the edge","f"
"1402","2012-12-07 11:57:58.446085+0000","2013-02-12 23:44:36.136975+0000","281","3","15","","a green cylindrical object","closest to the edge on the far end","f"
"1403","2012-12-07 11:57:58.452216+0000","2013-02-12 23:44:36.147502+0000","281","2","7","","a dark green cube","closest to the edge on the far end","f"
"1404","2012-12-07 11:57:58.464248+0000","2013-02-12 23:44:36.173367+0000","281","1","4","","a flat brown cylindrical object","almost in the centre of the table","f"
"1405","2012-12-07 11:57:58.474759+0000","2013-02-12 23:44:36.181810+0000","281","4","19","","a brown very flat cylindrical object ","slightly towards the edge in the middle of the table","f"
"1406","2012-12-07 12:02:29.730148+0000","2013-02-12 23:44:36.189606+0000","282","2","10","","in yellow color and cubic shape","to the left of the table ","f"
"1407","2012-12-07 12:02:29.739995+0000","2013-02-12 23:44:36.200581+0000","282","2","9","","in purple color ","nearest to the screen ","f"
"1408","2012-12-07 12:02:29.746755+0000","2013-02-12 23:44:36.211115+0000","282","1","1","","in purple color and cubic in shape","farthest to the screen","f"
"1409","2012-12-07 12:02:29.752874+0000","2013-02-12 23:44:36.219443+0000","282","5","23","","blue in color,cubic in shape","farthest to the screen and in centre of the table","f"
"1410","2012-12-07 12:02:29.760118+0000","2013-02-12 23:44:36.233198+0000","282","3","15","","in green color and cylindrical in shape","farthest to the screen and to the right side of the table","f"
"1411","2012-12-07 12:17:40.109002+0000","2013-02-12 23:44:36.242612+0000","283","3","11","","resides on the right middle of the table","object","f"
"1412","2012-12-07 12:17:40.125394+0000","2013-02-12 23:44:36.297906+0000","283","5","22","","resides on rightmost bottom","Object","f"
"1413","2012-12-07 12:17:40.135000+0000","2013-02-12 23:44:36.308782+0000","283","4","16","","on left hand diagonnally infront of object ","object","f"
"1414","2012-12-07 12:17:40.142351+0000","2013-02-12 23:44:36.333344+0000","283","1","1","","on back side of other object","Object","f"
"1415","2012-12-07 12:17:40.161112+0000","2013-02-12 23:44:36.355134+0000","283","3","13","","little front and leftmost of the object","object","f"
"1416","2012-12-07 12:44:58.205126+0000","2013-02-12 23:44:36.367315+0000","284","5","21","","a violet block","at the near dge of the table","f"
"1417","2012-12-07 12:44:58.214737+0000","2013-02-12 23:44:36.380397+0000","284","4","16","","yellow in colour","a box in the middle of the table.","f"
"1418","2012-12-07 12:44:58.225227+0000","2013-02-12 23:44:36.396007+0000","284","2","8","","violet in colour","block situated in the middle of the table","f"
"1419","2012-12-07 12:44:58.230255+0000","2013-02-12 23:44:36.410359+0000","284","4","17","","yellow block","near you","f"
"1420","2012-12-07 12:44:58.234684+0000","2013-02-12 23:44:36.427691+0000","284","5","22","","violet block","on the table","t"
"1421","2012-12-07 12:51:14.239721+0000","2013-02-12 23:44:36.443013+0000","285","2","10","","yellow in colour","placed at the far end of the table","f"
"1422","2012-12-07 12:51:14.250004+0000","2013-02-12 23:44:36.455019+0000","285","4","17","","is yellow in colour","placed behind the red colour object","f"
"1423","2012-12-07 12:51:14.265608+0000","2013-02-12 23:44:36.470018+0000","285","2","7","","is a cuboid","placed at the far end of the table","f"
"1424","2012-12-07 12:51:14.281399+0000","2013-02-12 23:44:36.480108+0000","285","5","21","","is green in colour and a cuboid","placed beside the small spherical object ","f"
"1425","2012-12-07 12:51:14.288732+0000","2013-02-12 23:44:36.489208+0000","285","5","22","","is a cuboid and purple in colour","placed on the right hand side of the table","f"
"1426","2012-12-07 12:57:34.562253+0000","2013-02-12 23:44:36.502223+0000","286","3","15","","circular and short and green","it is at the end of the table,in the right corner","f"
"1427","2012-12-07 12:57:34.568997+0000","2013-02-12 23:44:36.515531+0000","286","4","16","","green long and rectangle","it is almost in the middle of the table ,it is in front of a red ball","f"
"1428","2012-12-07 12:57:34.573432+0000","2013-02-12 23:44:36.724806+0000","286","3","12","","green,long rectangular only upright","near the middle of the table ,at the far side of the table,near the blue circle","f"
"1429","2012-12-07 12:57:34.577546+0000","2013-02-12 23:44:13.587102+0000","286","1","3","","upright,long,brownish,rectangular","near the right edge of the table,between two others rectangular adn one blue ball and one brownish circle","f"
"1430","2012-12-07 12:57:34.582281+0000","2013-02-12 23:44:36.530073+0000","286","3","11","","brownish,long,rectangular","it is closer to the shorter edge of the table,in fron of all the other shapes","f"
"1431","2012-12-07 13:28:01.530409+0000","2013-02-12 23:44:36.539418+0000","287","4","17","","rectangle ","big in size,it is a yellow colour","f"
"1432","2012-12-07 13:28:01.538188+0000","2013-02-12 23:44:36.546749+0000","287","4","19","","cylender","an orange color","f"
"1433","2012-12-07 13:28:01.543079+0000","2013-02-12 23:44:36.561077+0000","287","2","7","","square","an green colour, it is an small in size","f"
"1434","2012-12-07 13:28:01.549025+0000","2013-02-12 23:44:36.568121+0000","287","1","5","","circle","an ball, its colour blue","f"
"1435","2012-12-07 13:28:01.553982+0000","2013-02-12 23:44:36.574930+0000","287","5","25","","circle","a yellow colour","f"
"1436","2012-12-07 13:29:26.578247+0000","2013-02-12 23:44:36.602734+0000","288","3","13","","Round pale yellow color object ","placed near to blue object at left most corner of table.","f"
"1437","2012-12-07 13:29:26.585099+0000","2013-02-12 23:44:36.614603+0000","288","2","10","","  in yellow color and having square shape","placed in between one small square and one big square.","f"
"1438","2012-12-07 13:29:26.589772+0000","2013-02-12 23:44:36.632174+0000","288","2","7","","small green color square shape object","placed in corner of the table.","f"
"1439","2012-12-07 13:29:26.593940+0000","2013-02-12 23:44:36.644799+0000","288","2","9","","violet color cubic object","placed in left corner of the table.","f"
"1440","2012-12-07 13:29:26.598427+0000","2013-02-12 23:44:36.652271+0000","288","4","17","","yellow color rectangle object","placed in fron tof ","f"
"1441","2012-12-07 14:16:10.608633+0000","2013-02-12 23:44:36.672953+0000","289","4","20","","A red ball","in the center of the table.","f"
"1442","2012-12-07 14:16:10.615049+0000","2013-02-12 23:44:36.702824+0000","289","2","8","","a purple column.","in the center of the table.","t"
"1443","2012-12-07 14:16:10.619751+0000","2013-02-12 23:44:37.231277+0000","289","1","2","","a pink column.","on the far end of the table, near the center.","f"
"1444","2012-12-07 14:16:10.656821+0000","2013-02-12 23:44:37.246040+0000","289","2","9","","a purple cube.","on the lower left corner of the table.","f"
"1445","2012-12-07 14:16:10.661183+0000","2013-02-12 23:44:37.214249+0000","289","3","15","","a green disc.","on the far end of the table, a third from the right.","t"
"1446","2012-12-07 14:55:18.853583+0000","2013-02-12 23:44:37.263047+0000","290","4","16","","A Yelow long square shape object","in the corner of the table","f"
"1447","2012-12-07 14:55:18.860474+0000","2013-02-12 23:44:36.735495+0000","290","5","22","","Large violate Square  shaped object","on the edge of the table","f"
"1448","2012-12-07 14:55:18.871890+0000","2013-02-12 23:44:36.758131+0000","290","3","14","","a violate round square shape object","on near the edge of  the table","t"
"1449","2012-12-07 14:55:18.876864+0000","2013-02-12 23:44:36.782749+0000","290","3","12","","Green square shape obect","on near the midle edge of the table","f"
"1450","2012-12-07 14:55:18.882211+0000","2013-02-12 23:44:36.798118+0000","290","4","17","","large yellow square shaped object","on the midle edge of the corner","f"
"1451","2012-12-07 15:59:04.370505+0000","2013-02-12 23:44:36.807599+0000","291","3","11",""," a brown colour  rectangle piece ","located in towards centered and in the diagonal axis of object three straight axis of object one","f"
"1452","2012-12-07 15:59:04.387428+0000","2013-02-12 23:44:37.278955+0000","291","5","25",""," a yellow ball","located fully towards and in the right side of stright line of object one","f"
"1453","2012-12-07 15:59:04.658118+0000","2013-02-12 23:44:36.817001+0000","291","2","7","","a green cube","positioned on diagonal axis of object two and in the triangle of object one and three","f"
"1454","2012-12-07 15:59:04.671307+0000","2013-02-12 23:44:36.825889+0000","291","4","20","","a red ball"," placed centre of object two,four,five","f"
"1455","2012-12-07 15:59:04.683491+0000","2013-02-12 23:44:36.839156+0000","291","1","3","","a brown  rectangle","located in the centre of objects one ,two,four,five","f"
"1456","2012-12-07 16:41:55.530306+0000","2013-02-12 23:44:36.846963+0000","292","1","4","","is on top of a table right next to Object one. ","a sphere and it is right next to Object two.","f"
"1457","2012-12-07 16:41:55.540742+0000","2013-02-12 23:45:22.811111+0000","292","5","24","","a small sphere and it is next to Object five","square, which is bigger than Object two.","f"
"1458","2012-12-07 16:41:55.559417+0000","2013-02-12 23:45:22.824708+0000","292","3","15","","a green cylinder","by itself in a corner.","f"
