"id","created","modified","task_id","scene_id","entity_id","answer","object_description","location_description","use_in_object_tasks"
"2569","2012-12-12 15:04:15.474736+0000","2013-02-12 23:45:21.642466+0000","514","1","3","","tallest rectangular cuboid"," above the orange cylinder","t"
"2570","2012-12-12 15:04:15.492513+0000","2013-02-12 23:44:54.147325+0000","514","3","11","","the orange cuboid "," the last object on the table","f"
"2571","2012-12-12 16:03:56.199014+0000","2013-02-12 23:44:54.154397+0000","515","4","17","","Yellow rectangular block","the closest object to me on the table.","f"
"2572","2012-12-12 16:03:56.219935+0000","2013-02-12 23:44:54.172001+0000","515","1","4",""," short orange cylinder","to the imediate left and slightly behind the blue sphere.","t"
"2573","2012-12-12 16:03:56.256079+0000","2013-02-12 23:44:54.197023+0000","515","5","22","","purple cube","the nearest object to me on the table.","f"
"2574","2012-12-12 16:03:56.282325+0000","2013-02-12 23:44:54.207557+0000","515","3","12","","green rectangular block","slightly to the right and in front of the short blue cylinder.","f"
"2575","2012-12-12 16:03:56.289742+0000","2013-02-12 23:44:54.226542+0000","515","4","19","","short cylinder","to the left of the red sphere and behind the largest yellow rectangular block.","f"
"2576","2012-12-12 17:17:34.129052+0000","2013-02-12 23:44:54.260151+0000","516","5","25","","Big ball"," placed near to blue square box and Opposite side to Pink colour square box","f"
"2577","2012-12-12 17:17:34.225309+0000","2013-02-12 23:44:54.278171+0000","516","3","12","","Square Box"," placed near to blue colour small round material and almost in the center of the table.","f"
"2578","2012-12-12 17:17:34.234296+0000","2013-02-12 23:44:54.302978+0000","516","1","3","","Big Square"," placed in the rectangle table as one side have circle and ball and other side have Brown Colour square box.","f"
"2579","2012-12-12 17:17:34.242530+0000","2013-02-12 23:44:54.319936+0000","516","3","15","","Round material"," places in corner of rectangle table near to brown colour round material and straight to brown colour square material.","f"
"2580","2012-12-12 17:17:34.254638+0000","2013-02-12 23:44:54.339470+0000","516","5","21","","Square Box"," placed very near to small pink  colour round ball.","f"
"2581","2012-12-12 17:18:32.032811+0000","2013-02-12 23:44:54.357570+0000","517","5","21","","a green block.","just to the left of the purple ball, near the middle of the table.","f"
"2582","2012-12-12 17:18:32.040808+0000","2013-02-12 23:44:54.373715+0000","517","5","22","","a purple block","near the front edge of the table, towards the center","f"
"2583","2012-12-12 17:18:32.047780+0000","2013-02-12 23:44:54.391057+0000","517","2","10","","a yellow block","between two purple blocks, farther away and nearer the far end of the table","f"
"2584","2012-12-12 17:18:32.054746+0000","2013-02-12 23:44:54.405702+0000","517","5","25","","a yellow ball","is just right of the blue block, near the far end of the table.","f"
"2585","2012-12-12 17:18:32.061172+0000","2013-02-12 23:44:54.818571+0000","517","4","19","","an orange puck","to the left of the red ball, between the yellow blocks, near the middle of t he table.","t"
"2586","2012-12-12 17:25:30.774113+0000","2013-02-12 23:45:21.705959+0000","518","2","6","","purple cube","towards the back of table approximately two thirds of the length from front edge, along the left edge.","t"
"2587","2012-12-12 17:25:30.784651+0000","2013-02-12 23:44:54.427015+0000","518","2","7","","small green cube","three quarters from the left edge and is almost as far towards the back of table","f"
"2588","2012-12-12 17:25:30.791799+0000","2013-02-12 23:44:54.437526+0000","518","1","3","","an orange rectangle on standing on the smallest side","two thirds of the length of table back, and almost three quarters of the way across from the left edge","f"
"2589","2012-12-12 17:25:30.800269+0000","2013-02-12 23:44:54.445093+0000","518","4","17","","is a yellow rectangle laying sideways","approximately a quarter of the table length backwards from leading edge, positioned in the middle from left to right. the rectangles position is slightly skewed with its right side forward ","f"
"2590","2012-12-12 17:25:30.818020+0000","2013-02-12 23:44:54.470768+0000","518","5","24","","a small purple ball","kust under half way across from left edge, about three quarters of the way from leading edge","f"
"2591","2012-12-12 17:33:12.074201+0000","2013-02-12 23:44:54.500633+0000","519","5","24","","Circle","purple","f"
"2592","2012-12-12 17:33:12.083437+0000","2013-02-12 23:44:54.508446+0000","519","4","19","","round","left side","f"
"2593","2012-12-12 17:33:12.090187+0000","2013-02-12 23:44:54.518868+0000","519","2","9","","bix","meron ","f"
"2594","2012-12-12 17:33:12.096817+0000","2013-02-12 23:44:54.535245+0000","519","3","13","","Circle","Meron","f"
"2595","2012-12-12 17:33:12.103709+0000","2013-02-12 23:44:54.547265+0000","519","1","2","","square ","square is tall","f"
"2596","2012-12-12 18:33:59.241560+0000","2013-02-12 23:44:54.556057+0000","520","3","11","","book","corner","f"
"2597","2012-12-12 18:33:59.257001+0000","2013-02-12 23:44:54.567760+0000","520","1","3","","table","middle","f"
"2598","2012-12-12 18:33:59.266155+0000","2013-02-12 23:44:54.604510+0000","520","5","21","","square","left corner","f"
"2599","2012-12-12 18:33:59.274723+0000","2013-02-12 23:44:54.625749+0000","520","2","6","","square","left top corner","f"
"2600","2012-12-12 18:33:59.282387+0000","2013-02-12 23:44:54.633674+0000","520","5","23","","book","in the top of the table","t"
"2601","2012-12-12 18:39:42.439771+0000","2013-02-12 23:44:54.641374+0000","521","5","22","","at the front side of the table from the viewer","a purple cube","f"
"2602","2012-12-12 18:39:42.450689+0000","2013-02-12 23:44:54.662588+0000","521","1","3","","in middle of the four objects","an orangish brown rectangular cube","f"
"2603","2012-12-12 18:39:42.459760+0000","2013-02-12 23:44:54.680536+0000","521","5","21","","along with a purple sphere","a green rectangular cube","f"
"2604","2012-12-12 18:39:42.466143+0000","2013-02-12 23:44:54.709516+0000","521","2","8","","one of the purple cube","in middle of the table from top view","f"
"2605","2012-12-12 18:39:42.475393+0000","2013-02-12 23:44:54.721791+0000","521","2","10","","the only yellow cube","in between a purple cube from front and a small green cube from behind","f"
"2606","2012-12-12 19:51:10.286795+0000","2013-02-12 23:44:54.730180+0000","522","1","4","","a orange short cylinder.","at the left to the blue sphere.","f"
"2607","2012-12-12 19:51:10.312102+0000","2013-02-12 23:44:54.750559+0000","522","1","3","","an orange rectangle.","down of a purple rectangle.","f"
"2608","2012-12-12 19:51:10.320556+0000","2013-02-12 23:44:54.758703+0000","522","3","12","","a green rectangle.","close to a blue short cylindre.","f"
"2609","2012-12-12 19:51:10.335856+0000","2013-02-12 23:44:54.768369+0000","522","2","10","","a yellow half of a cube.","close to two purple figures and a tiny green cube.","f"
"2610","2012-12-12 19:51:10.344320+0000","2013-02-12 23:44:54.776792+0000","522","2","7","","a tiny green cube.","upper all the figures.","f"
"2611","2012-12-12 20:03:31.413239+0000","2013-02-12 23:44:54.808481+0000","523","5","23","","at the far end of the table.","a blue box, larger then other objects.","f"
"2612","2012-12-12 20:03:31.428192+0000","2013-02-12 23:44:54.841554+0000","523","4","16","","near the middle of the table","a small yellow box.","f"
"2613","2012-12-12 20:03:31.483799+0000","2013-02-12 23:44:55.513020+0000","523","2","9","","in the close left hand corner of the table.","a large purple cube.","f"
"2614","2012-12-12 20:03:31.491074+0000","2013-02-12 23:45:26.668786+0000","523","3","15","","on the right side of the far end of the table.","a green, small, short, cylinder.","f"
"2615","2012-12-12 20:03:31.498056+0000","2013-02-12 23:45:26.689150+0000","523","5","24","","in the middle of the table.","a small purple ball next to a green cube.","f"
"2616","2012-12-12 20:14:20.566609+0000","2013-02-12 23:45:26.697695+0000","524","5","25","","a yellow sphere","to the right of the blue rectangle","f"
"2617","2012-12-12 20:14:20.577154+0000","2013-02-12 23:44:54.856383+0000","524","4","19","","the only orange object","to the left of the red sphere","f"
"2618","2012-12-12 20:14:20.586546+0000","2013-02-12 23:44:54.907015+0000","524","5","24","","the tiny purple sphere","to the right of the green rectangle","f"
"2619","2012-12-12 20:14:20.594122+0000","2013-02-12 23:44:54.924937+0000","524","4","17","","the upward standing yellow rectangle","in the very front of the table","t"
"2620","2012-12-12 20:14:20.601697+0000","2013-02-12 23:45:21.883834+0000","524","3","13","","the orange partial-cylinder","in the very top left","t"
"2621","2012-12-12 20:15:55.521838+0000","2013-02-12 23:44:54.968568+0000","525","2","8","","a medium-sized purple cube","near the center of the table, to the right of the two other purple cubes.","f"
"2622","2012-12-12 20:15:55.535196+0000","2013-02-12 23:44:55.011201+0000","525","3","11","","an orange rectangle","nearer to the bottom right of the table than any other object.","f"
"2623","2012-12-12 20:15:55.541854+0000","2013-02-12 23:44:55.036040+0000","525","5","22","","a large purple cube","nearer to the bottom right of the table than any other object.","f"
"2624","2012-12-12 20:15:55.558421+0000","2013-02-12 23:44:55.045538+0000","525","1","3","","an orange rectangle","in the upper right-hand side of the table, roughly in the middle of the group of five objects.","f"
"2625","2012-12-12 20:15:55.575435+0000","2013-02-12 23:44:55.061539+0000","525","1","1","","a small purple cube","the upper rightmost object.","f"
"2626","2012-12-12 20:16:42.441799+0000","2013-02-12 23:44:55.072246+0000","526","2","8","","a cube","near the center of the table.","f"
"2627","2012-12-12 20:16:42.453008+0000","2013-02-12 23:44:55.090983+0000","526","1","4","","a short cylinder","next to a blue ball","f"
"2628","2012-12-12 20:16:42.463343+0000","2013-02-12 23:44:55.114036+0000","526","4","17","","a yellow rectangular box","in front of a red balll","f"
"2629","2012-12-12 20:16:42.472830+0000","2013-02-12 23:44:55.128171+0000","526","5","23","","blue cube","near the edge of a table behind a yellow ball","f"
"2630","2012-12-12 20:16:42.481184+0000","2013-02-12 23:44:55.142991+0000","526","1","2","","pink rectangular box","near two other rectangular boxes","f"
"2631","2012-12-12 20:17:03.856698+0000","2013-02-12 23:44:55.152293+0000","527","3","11","","a tall rectangular shaped brown object","about at the halfway point of the table and a little to the right.","f"
"2632","2012-12-12 20:17:03.868400+0000","2013-02-12 23:44:55.164515+0000","527","1","5","","a blue ball.","Directly next to the brown cylinder.","t"
"2633","2012-12-12 20:17:03.877230+0000","2013-02-12 23:44:55.175808+0000","527","5","23","","Blue rectangular object.","directly next to the yellow ball.","f"
"2634","2012-12-12 20:17:03.892930+0000","2013-02-12 23:44:55.191385+0000","527","4","16","","a yellow rectnagle laying on the table.","In the middle of the table to the back, left of the green square","f"
"2635","2012-12-12 20:17:03.900655+0000","2013-02-12 23:44:55.206588+0000","527","3","12","","a green rectangle","Next to the blue cylinder.","f"
"2636","2012-12-12 20:17:12.911393+0000","2013-02-12 23:44:55.224071+0000","528","4","20","","a red sphere","behind the upright yellow rectangle","f"
"2637","2012-12-12 20:17:12.919641+0000","2013-02-12 23:44:55.241805+0000","528","3","12","","a green rectangle ","next to the short blue cylinder","f"
"2638","2012-12-12 20:17:12.925278+0000","2013-02-12 23:45:27.003750+0000","528","2","9","","a purple cube","on the corner of the table","t"
"2639","2012-12-12 20:17:12.931485+0000","2013-02-12 23:44:55.264291+0000","528","2","8","","a purple rectangle","in the center of the table","f"
"2640","2012-12-12 20:17:12.937179+0000","2013-02-12 23:44:55.286262+0000","528","5","24","","a small purple sphere","aside the green rectangle in  the center of the table","f"
"2641","2012-12-12 20:17:47.077792+0000","2013-02-12 23:44:55.304192+0000","529","1","3","","a tall orange block","behind a blue ball and an orange cylinder and somewhat before a purple and a pink block","f"
"2642","2012-12-12 20:17:47.086480+0000","2013-02-12 23:44:55.324302+0000","529","5","22","","a large purple cube","very much in the forefront of the picture, ahead of all other objects","f"
"2643","2012-12-12 20:17:47.093522+0000","2013-02-12 23:44:55.381722+0000","529","5","24","","a very small purple sphere","far behind a large purple cube and next to a green cube","f"
"2644","2012-12-12 20:17:47.101312+0000","2013-02-12 23:44:55.434003+0000","529","3","11","","a tall orange cube","off to the side and ahead of the other objects in the image","f"
"2645","2012-12-12 20:17:47.110819+0000","2013-02-12 23:44:55.456921+0000","529","2","7","","a very small green cube","far behind the other objects in the image, sort of off to the side","f"
"2646","2012-12-12 20:17:48.630517+0000","2013-02-12 23:44:55.471188+0000","530","4","17","","a yellow block","closest to me","f"
"2647","2012-12-12 20:17:48.639056+0000","2013-02-12 23:44:55.480974+0000","530","2","8","","a purple block","in the middle of the table.","f"
"2648","2012-12-12 20:17:48.646034+0000","2013-02-12 23:44:55.495770+0000","530","1","2","","a pink block","the second to last object from me.","f"
"2649","2012-12-12 20:17:48.653640+0000","2013-02-12 23:45:26.736659+0000","530","2","9","","a purple block","on the near left corner of the table.","f"
"2650","2012-12-12 20:17:48.663752+0000","2013-02-12 23:45:26.745054+0000","530","4","20","","a red ball","in the middle of the table.","t"
"2651","2012-12-12 20:17:58.000240+0000","2013-02-12 23:45:26.756484+0000","531","3","11",""," a brownish-colored rectangle","to the center-right on the table","f"
"2652","2012-12-12 20:17:58.008754+0000","2013-02-12 23:45:26.764558+0000","531","3","14","","a small, somewhat flat blue disk","near the back, to the left","f"
"2653","2012-12-12 20:17:58.016349+0000","2013-02-12 23:44:17.537738+0000","531","5","24","","a small purple sphere","towards the back, in the center","f"
"2654","2012-12-12 20:17:58.023024+0000","2013-02-12 23:45:26.775807+0000","531","1","5","","a blue ball","to the right, in the center of the table, next to a brown disk","f"
"2655","2012-12-12 20:17:58.029854+0000","2013-02-12 23:45:26.793420+0000","531","5","22","","a purple square","near the front of the table, somewhat to the right","f"
"2656","2012-12-12 20:18:20.630454+0000","2013-02-12 23:45:26.801699+0000","532","2","8","","a medium-sized purple cube.","to the right of the small purple cube.","t"
"2657","2012-12-12 20:18:20.638443+0000","2013-02-12 23:45:26.817852+0000","532","3","14","","a small blue pie.","to the left of the green rectangle.","f"
"2658","2012-12-12 20:18:20.644378+0000","2013-02-12 23:45:26.853579+0000","532","4","20","","a red sphere.","to the right of the orange pie.","t"
"2659","2012-12-12 20:18:20.650314+0000","2013-02-12 23:45:26.866171+0000","532","3","13","","an orange pie.","to the left of the small green pie.","f"
"2660","2012-12-12 20:18:20.657649+0000","2013-02-12 23:45:26.880941+0000","532","2","9","","a large purple cube.","in front of all other objects, on the left side of the table.","f"
"2661","2012-12-12 20:18:56.063643+0000","2013-02-12 23:45:26.894666+0000","533","5","22","","a purple square","colorful","f"
"2662","2012-12-12 20:18:56.071700+0000","2013-02-12 23:45:26.902740+0000","533","3","15","","green cylinder","bright green","f"
"2663","2012-12-12 20:18:56.079156+0000","2013-02-12 23:45:26.930136+0000","533","5","25","","a yellow sphere","bright ","f"
"2664","2012-12-12 20:18:56.090143+0000","2013-02-12 23:45:26.951780+0000","533","4","19","","orange cylinder","layed out flat","f"
"2665","2012-12-12 20:18:56.096350+0000","2013-02-12 23:45:26.960209+0000","533","1","3","","standing rectangle","orange colored","f"
"2666","2012-12-12 20:18:56.990955+0000","2013-02-12 23:45:26.970598+0000","534","5","25","","a yellow ball.","at the end of the table, but closer than the blue square. The other objects on the table are closer than it.","f"
"2667","2012-12-12 20:18:56.999772+0000","2013-02-12 23:45:26.977132+0000","534","5","22","","a purple square","the closest object on the table. It is slightly to the viewers right.","f"
"2668","2012-12-12 20:18:57.006336+0000","2013-02-12 23:45:26.988799+0000","534","2","10","","a yellow square","located toward the back of the table, between two purple squares. It is behind the othe squares.","f"
"2669","2012-12-12 20:18:57.012392+0000","2013-02-12 23:45:26.995818+0000","534","1","1","","a purple square","at the very edge of the table to the back. It is behind all the other objects.","f"
"2670","2012-12-12 20:18:57.018555+0000","2013-02-12 23:44:56.331910+0000","534","3","15","","a green cylinder","at the back of the table, behind all of the other objects. It is some distance away from them.","f"
"2671","2012-12-12 20:19:24.084463+0000","2013-02-12 23:44:56.405395+0000","535","4","18","","Small green block","located near the back of the table","f"
"2672","2012-12-12 20:19:24.092692+0000","2013-02-12 23:44:56.414120+0000","535","2","7","","Small green cube","located near the edge of the table","f"
"2673","2012-12-12 20:19:24.098753+0000","2013-02-12 23:44:56.426406+0000","535","5","23","","medium sized dark blue cube","located next to the round yellow object near the edge of the table","f"
"2674","2012-12-12 20:19:24.104526+0000","2013-02-12 23:44:56.434091+0000","535","3","13","","flat orange circular object","located on the left side of the table near the edge","f"
"2675","2012-12-12 20:19:24.112941+0000","2013-02-12 23:44:56.446054+0000","535","1","5","","round blue ball","located near the front of the table","f"
"2676","2012-12-12 20:21:04.723756+0000","2013-02-12 23:44:56.461198+0000","536","1","1","","a purple rectangular prism","farthest away, behind the pink and orange rectangular prisms.","f"
"2677","2012-12-12 20:21:04.733529+0000","2013-02-12 23:44:56.472772+0000","536","4","19","","an orange cylinder","to the left of a red sphere and behind and to the left of a yellow rectangular prism.","f"
"2678","2012-12-12 20:21:04.740562+0000","2013-02-12 23:45:27.014229+0000","536","3","12","","a green rectangular prism","three-fourths table-length away from the front edge of the table, just left from the vertical middle.","f"
"2679","2012-12-12 20:21:04.749737+0000","2013-02-12 23:44:56.482722+0000","536","2","9","","a purple cube","in the front left corner of the table and the farthest away from the green cube.","f"
"2680","2012-12-12 20:21:04.758400+0000","2013-02-12 23:45:21.401311+0000","536","5","21","","green rectangular prism","to the left of a small purple sphere and about two-thirds table-length away from the front edge of the table.","t"
"2681","2012-12-12 20:21:08.556885+0000","2013-02-12 23:45:27.021620+0000","537","2","9","","Purple and is a cube","at the front edge of the table.","t"
"2682","2012-12-12 20:21:08.564819+0000","2013-02-12 23:45:27.028268+0000","537","1","3","","orange rectangular prism ","below the purple block and beside the pink","f"
"2683","2012-12-12 20:21:08.570968+0000","2013-02-12 23:45:27.035299+0000","537","5","22","","the biggest object that is purple","the closest object to the front edge.","f"
"2684","2012-12-12 20:21:08.582613+0000","2013-02-12 23:45:27.043658+0000","537","1","1","","the purple rectanglular prism","the one closest to the back edge","f"
"2685","2012-12-12 20:21:08.595252+0000","2013-02-12 23:45:27.051943+0000","537","4","19","","a cylinder  ","furthest to the left","f"
"2686","2012-12-12 20:21:42.688651+0000","2013-02-12 23:45:27.065987+0000","538","5","23","","blue","at the very top of the table","t"
"2687","2012-12-12 20:21:42.701740+0000","2013-02-12 23:45:27.084087+0000","538","4","17","","yellow","at the very bottom of the table. ","f"
"2688","2012-12-12 20:21:42.710386+0000","2013-02-12 23:45:27.091378+0000","538","3","12","","green","next to the blue disk.","f"
"2689","2012-12-12 20:21:42.718115+0000","2013-02-12 23:45:27.098317+0000","538","5","25","","yellow","next to the blue block","f"
"2690","2012-12-12 20:21:42.726442+0000","2013-02-12 23:45:27.105624+0000","538","5","22","","purple","at the very bottom of the table","f"
"2691","2012-12-12 20:21:45.394214+0000","2013-02-12 23:45:27.115288+0000","539","4","17","","a yellow rectangle ","One fourth of the way down the table, centered, in front of all other objects, ","f"
"2692","2012-12-12 20:21:45.404288+0000","2013-02-12 23:45:27.129641+0000","539","5","23","","blue rectangle","at the opposing end of the table, centered, behind all other objects","t"
"2693","2012-12-12 20:21:45.412626+0000","2013-02-12 23:45:27.136763+0000","539","3","12","","green rectangle","two thirds of the way down the table, slightly left of center, to the right of a blue cylinder","f"
"2694","2012-12-12 20:21:45.421950+0000","2013-02-12 23:45:27.143212+0000","539","3","14","","a blue cylinder","two thirds of the way down the length of the table, one third of the way down the width, to the left of the green rectangle","f"
"2695","2012-12-12 20:21:45.430122+0000","2013-02-12 23:44:17.547286+0000","539","1","2","","rose rectangle","one fourth of the way down the length of the table, slightly right of the center","f"
"2696","2012-12-12 20:21:55.669665+0000","2013-02-12 23:44:17.557961+0000","540","5","24","","a green rectangular cube","in the middle of the table next to a purple ball","f"
"2697","2012-12-12 20:21:55.682501+0000","2013-02-12 23:44:55.553721+0000","540","3","11","","a brown rectangle ","on the right side towards the bottom","f"
"2698","2012-12-12 20:21:55.691058+0000","2013-02-12 23:44:55.572415+0000","540","4","18","","a green cube","near the top right corner","f"
"2699","2012-12-12 20:21:55.704798+0000","2013-02-12 23:44:55.594366+0000","540","1","3","","a rectabgle","in the middle","f"
"2700","2012-12-12 20:21:55.712478+0000","2013-02-12 23:44:55.714419+0000","540","2","10","","yellow/green cube","near the back in the left corner","f"
"2701","2012-12-12 20:22:44.285360+0000","2013-02-12 23:45:30.113220+0000","541","5","24","","circle","in the middle","f"
"2702","2012-12-12 20:22:44.295319+0000","2013-02-12 23:44:55.752723+0000","541","3","11","","rectangle","first object on the right","f"
"2703","2012-12-12 20:22:44.303455+0000","2013-02-12 23:44:55.764783+0000","541","5","21","","rectangle","toward the left and at the end","f"
"2704","2012-12-12 20:22:44.310935+0000","2013-02-12 23:44:55.774807+0000","541","2","6","","square","third square on the left","f"
"2705","2012-12-12 20:22:44.329221+0000","2013-02-12 23:44:55.795220+0000","541","2","8","","square","the second square on the right","f"
"2706","2012-12-12 20:22:45.485188+0000","2013-02-12 23:44:55.826583+0000","542","5","25","","the yellow sphere","just in front and to the right of the blue rectangular prism at the back.","f"
"2707","2012-12-12 20:22:45.493780+0000","2013-02-12 23:44:55.868390+0000","542","5","24","","the purple sphere","in the middle of the table just to the right of the green rectangular prism.","f"
"2708","2012-12-12 20:22:45.500164+0000","2013-02-12 23:44:55.912178+0000","542","1","1","","the dark purple rectangular prism","nearest the back right corner of the table.","f"
"2709","2012-12-12 20:22:45.506370+0000","2013-02-12 23:44:55.925643+0000","542","3","13","","the orange cylinder","the object nearest the back left corner of the table.","f"
"2710","2012-12-12 20:22:45.512958+0000","2013-02-12 23:44:55.936975+0000","542","4","17","","the larger yellow rectangular prism","nearest the front of the table.","f"
"2711","2012-12-12 20:22:47.464742+0000","2013-02-12 23:44:55.945542+0000","543","4","19","","to the left of the red ball.","a short circular brown cylindar","f"
"2712","2012-12-12 20:22:47.478782+0000","2013-02-12 23:44:55.953134+0000","543","5","21","","right next to the small purple ball","a green rectangle","f"
"2713","2012-12-12 20:22:47.485667+0000","2013-02-12 23:44:55.964465+0000","543","3","11","","a tall brown rectangle towards the front of the table","standing alone in the front","f"
"2714","2012-12-12 20:22:47.492926+0000","2013-02-12 23:44:56.025550+0000","543","3","12","","to the right of a blue circle","a green rectangle","f"
"2715","2012-12-12 20:22:47.510260+0000","2013-02-12 23:45:23.057589+0000","543","4","18","","a small green rectangle","towards the back of the table by itself","f"
"2716","2012-12-12 20:23:19.736385+0000","2013-02-12 23:45:23.066119+0000","544","5","23","","the blue cube","on the far left side of the table","f"
"2717","2012-12-12 20:23:19.745000+0000","2013-02-12 23:45:23.078616+0000","544","1","1","","the purple cube","on the far right side of the table","f"
"2718","2012-12-12 20:23:19.751977+0000","2013-02-12 23:45:23.085815+0000","544","3","13","","the orange short cylinder","to the far left of the table","f"
"2719","2012-12-12 20:23:19.759125+0000","2013-02-12 23:45:23.095796+0000","544","3","11","","the tall, thin box","in the middle right of the table","f"
"2720","2012-12-12 20:23:19.766128+0000","2013-02-12 23:45:23.102908+0000","544","3","12","","the green box","to the far left of the table","f"
"2721","2012-12-12 20:23:53.830551+0000","2013-02-12 23:45:23.113768+0000","545","5","25","","a large yellow ball.","at the end of the table, in front of the blue box. ","f"
"2722","2012-12-12 20:23:53.838502+0000","2013-02-12 23:44:56.046818+0000","545","5","21","","a small green box.","near the middle of the table, next to the tiny purple ball. ","f"
"2723","2012-12-12 20:23:53.844980+0000","2013-02-12 23:44:56.108936+0000","545","3","14","","a small cylindrical blue cap. ","near the top left corner, under the brown cylinder cap. ","f"
