"id","created","modified","task_id","scene_id","entity_id","answer","object_description","location_description","use_in_object_tasks"
"3940","2012-12-13 00:44:15.939492+0000","2013-02-12 23:45:14.573731+0000","788","3","12","","the green rectangle","to the right of the blue cylinder","t"
"3941","2012-12-13 00:46:06.102668+0000","2013-02-12 23:45:14.270429+0000","789","2","7","","a small, green square","located at the back of the table.","f"
"3942","2012-12-13 00:46:06.117464+0000","2013-02-12 23:45:14.280171+0000","789","4","16","","a low yellow rectangle","located near the center of the table","f"
"3943","2012-12-13 00:46:06.131773+0000","2013-02-12 23:45:14.287532+0000","789","1","2","","a tall peach colored rectangle","upright near the back of the table","f"
"3944","2012-12-13 00:46:06.140196+0000","2013-02-12 23:45:14.300272+0000","789","4","17","","a large yellow rectangle","the closest object","f"
"3945","2012-12-13 00:46:06.148781+0000","2013-02-12 23:45:14.307825+0000","789","3","14","","a small, dark blue cylinder.","towards the back of the table.","f"
"3946","2012-12-13 00:49:07.918272+0000","2013-02-12 23:45:14.318763+0000","790","4","18","","green","the furthest away","f"
"3947","2012-12-13 00:49:07.927770+0000","2013-02-12 23:45:14.326285+0000","790","2","10","","the yellow cube","behind the purple cubes, but in front of the green cube.","f"
"3948","2012-12-13 00:49:07.935276+0000","2013-02-12 23:45:14.333349+0000","790","3","14","","the blue cylinder","the cylinder closest to the front of the table.","f"
"3949","2012-12-13 00:49:07.943580+0000","2013-02-12 23:45:14.340540+0000","790","2","7","","the tiny green cube","the object closest to the back edge of the table.","f"
"3950","2012-12-13 00:49:07.956063+0000","2013-02-12 23:45:14.388384+0000","790","1","4","","the cylinder","to the left of the sphere.","f"
"3951","2012-12-13 00:51:12.618618+0000","2013-02-12 23:45:14.405051+0000","791","2","10","","a  yellow prism","in front of the smallest cube","t"
"3952","2012-12-13 00:51:12.629967+0000","2013-02-12 23:45:14.438383+0000","791","3","11","","in front of all of the other objects","the tall prism","f"
"3953","2012-12-13 00:51:12.638164+0000","2013-02-12 23:45:14.454674+0000","791","1","1","","a purple prism","the furthest back","f"
"3954","2012-12-13 00:51:12.659632+0000","2013-02-12 23:45:14.481847+0000","791","4","20","","the red ball","next to the orange cylinder","f"
"3955","2012-12-13 00:51:12.667350+0000","2013-02-12 23:45:14.492471+0000","791","2","8","","in front of the smallest purple cube but behind the widest purple cube","is the object","f"
"3956","2012-12-13 00:53:15.730712+0000","2013-02-12 23:45:14.554402+0000","792","5","22","","a purple box with a blue number on top","in the front of the table, to the right","f"
"3957","2012-12-13 00:53:15.740561+0000","2013-02-12 23:45:22.130497+0000","792","1","5","","a blue sphere ","in front of all other objects","f"
"3958","2012-12-13 00:53:15.749183+0000","2013-02-12 23:45:14.564986+0000","792","3","14","","a blue object with a number on top","to the left of the four in the back of the table","f"
"3959","2012-12-13 00:53:15.757717+0000","2013-02-12 23:45:14.600572+0000","792","1","4","","an orange object behind the sphere","next to the blue sphere in the middle of the table","f"
"3960","2012-12-13 00:53:15.765677+0000","2013-02-12 23:45:23.534412+0000","792","1","2","","a pale rectangle","in the back of the table","f"
"3961","2012-12-13 00:55:20.542665+0000","2013-02-12 23:45:23.541714+0000","793","2","6","","In front and to the left of the yellow one","the dark purple one.","f"
"3962","2012-12-13 00:55:20.551659+0000","2013-02-12 23:45:23.549275+0000","793","3","12","","to the right of the green square","the blue circle","f"
"3963","2012-12-13 00:55:20.558463+0000","2013-02-12 23:45:23.556773+0000","793","5","24","","the smallest circle","to the right of the green box","f"
"3964","2012-12-13 00:55:20.565135+0000","2013-02-12 23:45:23.563849+0000","793","3","13","","the orange circle","behind the blue circle","f"
"3965","2012-12-13 00:55:20.571591+0000","2013-02-12 23:45:23.571304+0000","793","4","19","","the flat orange circle","to the left of the red circle","f"
"3966","2012-12-13 00:56:25.678772+0000","2013-02-12 23:45:23.578105+0000","794","2","8","","a medium sized purple rectangle","laying on its small end in the middle of the table","f"
"3967","2012-12-13 00:56:25.687018+0000","2013-02-12 23:45:29.865261+0000","794","3","13","","an orange circular disc","laying on its flat side in the back left of the table","f"
"3968","2012-12-13 00:56:25.694041+0000","2013-02-12 23:45:23.586203+0000","794","4","17","","a tan rectangle","laying on its small width side in the front middle of the table","f"
"3969","2012-12-13 00:56:25.700968+0000","2013-02-12 23:45:23.593424+0000","794","1","2","","a light purple rectangle","laying on the small rectangular portion in the back middle of the table","f"
"3970","2012-12-13 00:56:25.707369+0000","2013-02-12 23:45:23.601415+0000","794","5","24","","a small purple ball","laying next to a green rectangle in the middle of the table","f"
"3971","2012-12-13 00:56:53.041808+0000","2013-02-12 23:45:23.608689+0000","795","2","9","","a purple cube","the closest object or the object farthest down on the table.","f"
"3972","2012-12-13 00:56:53.049475+0000","2013-02-12 23:45:23.627192+0000","795","4","19","","the orange cylinder ","to the left of the red sphere.","f"
"3973","2012-12-13 00:56:53.056389+0000","2013-02-12 23:45:23.634100+0000","795","4","20","","the red sphere","between the two yellow rectangles and to the right of the orange cylinder.","f"
"3974","2012-12-13 00:56:53.062231+0000","2013-02-12 23:45:23.641816+0000","795","4","17","","one of the yellow rectangles","beneath the red sphere and the closest object to the bottom of the table.","f"
"3975","2012-12-13 00:56:53.074300+0000","2013-02-12 23:45:23.648776+0000","795","1","1","","the purple rectangle","the object closest to the top side of the table.","f"
"3976","2012-12-13 00:59:38.440140+0000","2013-02-12 23:45:23.660945+0000","796","2","10","","a mustard colored cube","second closest to the north edge of the table","f"
"3977","2012-12-13 00:59:38.450307+0000","2013-02-12 23:45:23.667743+0000","796","1","4","","a brown cylinder","right next to a blue ball in the middle of the table","f"
"3978","2012-12-13 00:59:38.458081+0000","2013-02-12 23:45:23.674651+0000","796","3","11","","a brown rectangle","located closest to the right edge of the table","f"
"3979","2012-12-13 00:59:38.473746+0000","2013-02-12 23:45:23.681852+0000","796","5","21","","a green cube","next to a tiny green ball and it is the closest object to the right side of the table","f"
"3980","2012-12-13 00:59:38.484234+0000","2013-02-12 23:45:23.688339+0000","796","3","15","","a green cylinder","closest to the top edge of the table","f"
"3981","2012-12-13 01:00:24.674801+0000","2013-02-12 23:45:23.710047+0000","797","5","21",""," a small box"," next to the small ball","f"
"3982","2012-12-13 01:00:24.689292+0000","2013-02-12 23:45:23.733476+0000","797","1","1","","a tall purple cube","closest to the right upper corner","f"
"3983","2012-12-13 01:00:24.696948+0000","2013-02-12 23:45:23.748090+0000","797","1","4","","a round orange cilinder","touching a blue ball","f"
"3984","2012-12-13 01:00:24.704482+0000","2013-02-12 23:45:23.755242+0000","797","4","20","","a red ball","in the middle of the table","f"
"3985","2012-12-13 01:00:24.713056+0000","2013-02-12 23:45:14.607572+0000","797","3","13","","a orange cilander","by the upper left corner","f"
"3986","2012-12-13 01:01:07.586367+0000","2013-02-12 23:45:14.624620+0000","798","5","23","","Blue rectangle","farthest away, almost on the edge of the table","f"
"3987","2012-12-13 01:01:07.597855+0000","2013-02-12 23:45:23.763364+0000","798","4","19","","Orange Cylinder","Fairly close, same distance away from you as the sphere","f"
"3988","2012-12-13 01:01:07.605775+0000","2013-02-12 23:45:14.664963+0000","798","3","11","","Orange rectangular prism","closest to you","t"
"3989","2012-12-13 01:01:07.613432+0000","2013-02-12 23:45:23.770182+0000","798","2","9","","Purple cube","very close to you","t"
"3990","2012-12-13 01:01:07.620388+0000","2013-02-12 23:45:23.779121+0000","798","1","3","","Orange rectangular prism","somewhat far away from you.","f"
"3991","2012-12-13 01:02:56.551274+0000","2013-02-12 23:45:23.786354+0000","799","1","2","","a light purple rectangle.","slightly to the left and under the dark purple rectangle.","f"
"3992","2012-12-13 01:02:56.560509+0000","2013-02-12 23:45:23.797205+0000","799","1","4","","a large brown circle","midway up the table and to the left of the large blue ball.","f"
"3993","2012-12-13 01:02:56.567245+0000","2013-02-12 23:45:23.804674+0000","799","5","22","","a large dark purple cube","near the bottom of the table and slightly to the right side.","f"
"3994","2012-12-13 01:02:56.574085+0000","2013-02-12 23:45:23.812024+0000","799","5","23","","an upright blue rectangle.","almost touching the yellow ball. It is slightly to the left and above the ball","f"
"3995","2012-12-13 01:02:56.582152+0000","2013-02-12 23:45:23.820523+0000","799","5","24","","a small dark purple ball","directly to the right of the green rectangle.","f"
"3996","2012-12-13 01:08:36.821090+0000","2013-02-12 23:45:23.837273+0000","800","2","10","","a golden cube.","towards the back leftside of the table.","t"
"3997","2012-12-13 01:08:36.833946+0000","2013-02-12 23:45:21.901276+0000","800","5","25","","a yellow and round ball.","towards the back right center of the table.","t"
"3998","2012-12-13 01:08:36.843876+0000","2013-02-12 23:45:23.844712+0000","800","4","20","","a red, round ball.","in the center of the table.","t"
"3999","2012-12-13 01:08:36.850903+0000","2013-02-12 23:45:23.852996+0000","800","3","14","","a small blue cyclinder shape.","on the leftside, towards the back of the table.","f"
"4000","2012-12-13 01:08:36.869288+0000","2013-02-12 23:45:23.866442+0000","800","2","6","","a purple cube.","on the leftside of the table, very close to the edge.","f"
"4001","2012-12-13 01:19:42.144655+0000","2013-02-12 23:45:23.875001+0000","801","3","11","","a dark orange rectangle","centered in the middle horizontally but off to left vertically","f"
"4002","2012-12-13 01:19:42.165982+0000","2013-02-12 23:45:23.883722+0000","801","2","9","","dark purple square","in the bottom left corner","f"
"4003","2012-12-13 01:19:42.174895+0000","2013-02-12 23:45:23.890711+0000","801","2","10","","dark yellow square","top left corner of the table","f"
"4004","2012-12-13 01:19:42.183710+0000","2013-02-12 23:45:23.926402+0000","801","4","18","","a small green aquare","top middle of the table","f"
"4005","2012-12-13 01:19:42.192038+0000","2013-02-12 23:45:23.936160+0000","801","2","8","","purple square","in the middle of the table","f"
"4006","2012-12-13 01:22:10.132819+0000","2013-02-12 23:45:29.874125+0000","802","1","1","","a purple rectangular prism","the furthest away, and the closest to the end of the table","f"
"4007","2012-12-13 01:22:10.142821+0000","2013-02-12 23:45:14.685291+0000","802","3","14","","a blue cynlinder","the second object to the far left, and the third furthest from me.","f"
"4008","2012-12-13 01:22:10.154014+0000","2013-02-12 23:45:14.726069+0000","802","2","10","","a yellow cube","behind all but one object","f"
"4009","2012-12-13 01:22:10.165622+0000","2013-02-12 23:45:14.768057+0000","802","2","6","","a small purple cube","near the  left edge of the table","f"
"4010","2012-12-13 01:22:10.179670+0000","2013-02-12 23:45:14.783874+0000","802","1","5","","a blue sphere","closer to me than all the other objects","f"
"4011","2012-12-13 01:24:40.603746+0000","2013-02-12 23:45:14.807790+0000","803","2","6","","a purple cube","on the left side of the table, in front of the yellow cube","f"
"4012","2012-12-13 01:24:41.192661+0000","2013-02-12 23:45:14.815833+0000","803","3","13","","a short orange cylinder","at the back left corner of the table","f"
"4013","2012-12-13 01:24:41.208402+0000","2013-02-12 23:45:14.824206+0000","803","5","25","","yellow sphere","between the blue cube and the purple sphere","f"
"4014","2012-12-13 01:24:41.216153+0000","2013-02-12 23:45:14.842681+0000","803","1","2","","pink box","toward the back side of the table in the middle","f"
"4015","2012-12-13 01:24:41.229421+0000","2013-02-12 23:45:14.850353+0000","803","3","14","","short blue cylinder","on the left side of the table to the left of the green box","f"
"4016","2012-12-13 01:27:57.304018+0000","2013-02-12 23:45:14.884267+0000","804","5","22","","closest to my perspective","the purple cube","f"
"4017","2012-12-13 01:27:57.325527+0000","2013-02-12 23:45:14.868859+0000","804","2","10","","second farthest from my perspective","the yellow cube, object","f"
"4018","2012-12-13 01:27:57.332418+0000","2013-02-12 23:45:14.898184+0000","804","2","6","","third farthest","object, the smallest purple cube.","f"
"4019","2012-12-13 01:27:57.338261+0000","2013-02-12 23:45:14.912739+0000","804","4","17","","closest to my perspective","the largest yellow rectangle","f"
"4020","2012-12-13 01:27:57.344980+0000","2013-02-12 23:45:14.923994+0000","804","2","8","","the second closest from my perspective","the purple rectangle","f"
"4021","2012-12-13 01:33:24.218619+0000","2013-02-12 23:45:14.942865+0000","805","4","19","","a round cylinder object that is orange","closest to the left side of the table","f"
"4022","2012-12-13 01:33:24.229640+0000","2013-02-12 23:45:14.952707+0000","805","4","20","","a red round ball","in the middle of the table close to the orange cylinder","f"
"4023","2012-12-13 01:33:24.245347+0000","2013-02-12 23:45:14.964575+0000","805","2","9","","a purple block","near the far left corner of the table","t"
"4024","2012-12-13 01:33:24.253218+0000","2013-02-12 23:45:14.985334+0000","805","2","8","","a purple block, rectangular in shape","in the middle of the table, closer to the right side of the table","t"
"4025","2012-12-13 01:33:24.259670+0000","2013-02-12 23:45:14.993531+0000","805","1","3","","a tall purple rectangle","in the middle of the table, near the right side, below the pink rectangle","f"
"4026","2012-12-13 01:33:53.670375+0000","2013-02-12 23:45:15.021743+0000","806","2","6","","blue small cube","closer than half and farther than half of the other objects","f"
"4027","2012-12-13 01:33:53.679604+0000","2013-02-12 23:45:15.031773+0000","806","2","7","","very small green cube","farther than all the other objects","f"
"4028","2012-12-13 01:33:53.686586+0000","2013-02-12 23:45:15.050052+0000","806","4","16","","rectangular prism that is green","farthest object except for green cube","f"
"4029","2012-12-13 01:33:53.702268+0000","2013-02-12 23:45:15.082391+0000","806","1","1","","purple rectangular prism","farthest object","f"
"4030","2012-12-13 01:33:53.709478+0000","2013-02-12 23:45:15.130022+0000","806","3","12","","green rectangular prism","second closest object","f"
"4031","2012-12-13 01:35:02.808839+0000","2013-02-12 23:45:15.145606+0000","807","3","13","","the orange circular object","at the back left corner of the table.","f"
"4032","2012-12-13 01:35:02.828321+0000","2013-02-12 23:45:15.159519+0000","807","1","5","","the spherical blue object","beside the orange circular object.","f"
"4033","2012-12-13 01:35:02.840211+0000","2013-02-12 23:45:15.831513+0000","807","4","18","","the green object","near the back right corner of the table","f"
"4034","2012-12-13 01:35:02.851131+0000","2013-02-12 23:45:15.168269+0000","807","1","3","","the square orange object","between the round circular object and the pink object.","f"
"4035","2012-12-13 01:35:02.859574+0000","2013-02-12 23:45:15.185000+0000","807","1","2","","the pink object","between the purple object and the square orange object.","f"
"4036","2012-12-13 01:39:26.659614+0000","2013-02-12 23:45:15.208731+0000","808","5","24","","is a tiny purple ball","next to the green square in the middle of the table.","f"
"4037","2012-12-13 01:39:26.667820+0000","2013-02-12 23:45:15.239379+0000","808","2","8","","a large purple block","in the middle of the table.","t"
"4038","2012-12-13 01:39:26.674347+0000","2013-02-12 23:45:15.246823+0000","808","5","25","","a yellow ball","near the back, next to the blue square.","f"
"4039","2012-12-13 01:39:26.680329+0000","2013-02-12 23:45:15.256424+0000","808","1","1","","a purple block","in the back of the table.","f"
"4040","2012-12-13 01:39:26.686225+0000","2013-02-12 23:45:15.275788+0000","808","4","20","","a red ball","behind the yellow block, next to the orange disk.","f"
"4041","2012-12-13 01:46:13.956201+0000","2013-02-12 23:45:15.291789+0000","809","3","11","","an orange brownish rectangle placed upright on one of its smaller faces","located a couple of inches to the right of the center of the table","f"
"4042","2012-12-13 01:46:13.969148+0000","2013-02-12 23:45:15.299603+0000","809","1","5","","a blue sphere","placed in front of an short orange cylinder near the center of the table","f"
"4043","2012-12-13 01:46:13.976565+0000","2013-02-12 23:45:15.309207+0000","809","1","3","","an orange rectangle placed upright on one of its smaller faces","located in the left farthest quadrant of the table","f"
"4044","2012-12-13 01:46:13.984274+0000","2013-02-12 23:45:15.320005+0000","809","5","23","","a blue cube","placed a couple of inches inwards from the far back edge of the table","f"
"4045","2012-12-13 01:46:13.993426+0000","2013-02-12 23:45:15.330178+0000","809","5","24","","small purple sphere","located next to the green cube near the center of the table","f"
"4046","2012-12-13 01:52:51.615484+0000","2013-02-12 23:45:15.339998+0000","810","1","3","","an orange rectangular block","in the middle of the other objects","f"
"4047","2012-12-13 01:52:51.635483+0000","2013-02-12 23:45:15.361726+0000","810","3","12","","a green square","behind the orange block but before the blue circle","f"
"4048","2012-12-13 01:52:51.642729+0000","2013-02-12 23:45:15.405387+0000","810","3","11","","an orange rectangular block","right in front","t"
"4049","2012-12-13 01:52:51.656807+0000","2013-02-12 23:45:14.857425+0000","810","3","15","","a small green cylinder","in the back of the objects","f"
"4050","2012-12-13 01:52:51.677141+0000","2013-02-12 23:45:15.418453+0000","810","1","2","","a pink rectangular block","in front of the purple block but behind the orange rectangular block","f"
"4051","2012-12-13 01:54:46.374395+0000","2013-02-12 23:45:15.426795+0000","811","5","25","","a yellow ball","next to a blue square.","f"
"4052","2012-12-13 01:54:46.384808+0000","2013-02-12 23:45:15.433432+0000","811","4","16","","a yellow rectangle","between a green square and an orange circle.","t"
"4053","2012-12-13 01:54:46.390762+0000","2013-02-12 23:45:15.788503+0000","811","5","21","","a green rectangle","next to a purple ball.","t"
"4054","2012-12-13 01:54:46.396666+0000","2013-02-12 23:45:15.440560+0000","811","1","5","","a blue ball","next to an orange circle.","f"
"4055","2012-12-13 01:54:46.402714+0000","2013-02-12 23:45:15.451472+0000","811","2","7","","a green square","closest to the top right corner of the table.","f"
"4056","2012-12-13 01:54:55.838144+0000","2013-02-12 23:45:15.478400+0000","812","1","4","","orange cylinder","second closest","f"
"4057","2012-12-13 01:54:55.875880+0000","2013-02-12 23:45:15.489175+0000","812","2","10","","yellow cube","second furthest","f"
"4058","2012-12-13 01:54:55.895243+0000","2013-02-12 23:45:15.521849+0000","812","3","15","","green cylinder","furthest","f"
"4059","2012-12-13 01:54:55.902893+0000","2013-02-12 23:45:15.535840+0000","812","4","18","","green cube","furthest","f"
"4060","2012-12-13 01:54:55.965458+0000","2013-02-12 23:45:15.551799+0000","812","2","9","","purple cube","closest","f"
"4061","2012-12-13 01:59:05.730535+0000","2013-02-12 23:45:15.581516+0000","813","5","25","","Circle","next to the blue square","f"
"4062","2012-12-13 01:59:05.737966+0000","2013-02-12 23:45:15.593208+0000","813","5","24","","a puple small circle","center of the table next tot he green square","f"
"4063","2012-12-13 01:59:05.749486+0000","2013-02-12 23:45:15.607299+0000","813","5","23","","Blue square top of the table","next to the yellow circle","f"
"4064","2012-12-13 01:59:05.756090+0000","2013-02-12 23:45:15.648461+0000","813","2","10","","yellow square","the only yellow square on the table","f"
"4065","2012-12-13 01:59:05.762353+0000","2013-02-12 23:45:30.090237+0000","813","5","21","","green square","next to the small purple circle","t"
"4066","2012-12-13 01:59:44.162547+0000","2013-02-12 23:45:15.657357+0000","814","5","23","","a blue square","centered towards the rear of the table.","f"
"4067","2012-12-13 01:59:44.172848+0000","2013-02-12 23:45:15.675104+0000","814","3","12",""," a green rectangular square","centered and slightly on the left side of the table.","f"
"4068","2012-12-13 01:59:44.180570+0000","2013-02-12 23:45:15.688628+0000","814","2","9",""," a purple square","at the forefront on the left side of the table.","f"
"4069","2012-12-13 01:59:44.188268+0000","2013-02-12 23:45:15.708261+0000","814","5","21","","a green rectangular square ","in the center of the table","t"
"4070","2012-12-13 01:59:44.194545+0000","2013-02-12 23:45:15.724953+0000","814","5","24","","a purple sphere","in the center of the table.","f"
"4071","2012-12-13 02:05:57.231225+0000","2013-02-12 23:45:15.742411+0000","815","5","21","","a green rectangular prism on it's long side","the farthest left of any of the objects and right next to the small purple sphere. It's distance relative to the depth of the image is about halfway back on the table and in the array of objects.","f"
"4072","2012-12-13 02:05:57.241744+0000","2013-02-12 23:45:15.763972+0000","815","1","5","","A medium-sized blue sphere","The closest of any of the objects and a little on the right side of the table without being near the edge. It is right next to the orange cylinder and about halfway back on the table, depth-wise","f"
"4073","2012-12-13 02:05:57.249133+0000","2013-02-12 23:45:29.881540+0000","815","2","8","","A large purple rectangular prism on it's short face"," slightly off-center to the right and back. It is not near the edge of the table or other objects. A smaller purple rectangular prism is in front of it and all the others are behind it.","f"
"4074","2012-12-13 02:05:57.256621+0000","2013-02-12 23:45:16.714397+0000","815","4","17","","A yellow rectangular prism on it's long side at a slight diagonal","foremost of all the objects, and directly in front of the red sphere. It is somewhat close to the front edge of the table and towards the center.","f"
"4075","2012-12-13 02:05:57.263519+0000","2013-02-12 23:45:15.849413+0000","815","4","16","","a yellow rectangular prism on it's largest face","towards the back of the table, almost in line with the other yellow rectangular prism but slightly to the left and near the back edge of the table. The only object behind it is the green one","f"
"4076","2012-12-13 02:06:54.233746+0000","2013-02-12 23:45:15.867910+0000","816","4","20","","a red ball","next to a orange  disc","f"
"4077","2012-12-13 02:06:54.241857+0000","2013-02-12 23:45:15.880545+0000","816","5","24","","small purple ball","next to a green block","f"
"4078","2012-12-13 02:06:54.248670+0000","2013-02-12 23:45:15.888780+0000","816","5","21","","green block","next to the small purple ball","f"
"4079","2012-12-13 02:06:54.255579+0000","2013-02-12 23:45:15.896121+0000","816","5","25","","a large yellow ball","next to a blue block","f"
"4080","2012-12-13 02:06:54.261488+0000","2013-02-12 23:45:15.940828+0000","816","1","5","","a blue ball","next to orange disc","f"
"4081","2012-12-13 02:09:11.519918+0000","2013-02-12 23:45:15.962646+0000","817","1","4","","a tube","next to a blue ball on a black table","f"
"4082","2012-12-13 02:09:11.529642+0000","2013-02-12 23:45:15.971954+0000","817","2","6","","a cube","positioned on the left of the table inbetween purple and yellow cubes","f"
"4083","2012-12-13 02:09:11.537622+0000","2013-02-12 23:45:15.980653+0000","817","1","1","","tower","on the right back of the table behind all other objects","f"
"4084","2012-12-13 02:09:11.544788+0000","2013-02-12 23:45:16.033127+0000","817","5","23","","a box","touching the yellow ball in the middle back of the table","f"
"4085","2012-12-13 02:09:11.552182+0000","2013-02-12 23:45:21.732691+0000","817","3","15","","small tube","back of the table on the right ","t"
"4086","2012-12-13 02:09:26.551697+0000","2013-02-12 23:45:16.043803+0000","818","3","13","","a circular orange object.","near the back right corner of the table.","f"
"4087","2012-12-13 02:09:26.559901+0000","2013-02-12 23:45:16.054640+0000","818","3","14",""," a small blue circular object","near the back right corner of the table.","f"
"4088","2012-12-13 02:09:26.565894+0000","2013-02-12 23:45:16.086374+0000","818","5","25","","an egg shaped yellow object","in the middle near the back","f"
"4089","2012-12-13 02:09:26.571655+0000","2013-02-12 23:45:16.132139+0000","818","2","7","","a small square that is green","near the back, closest to the back left corner","f"
"4090","2012-12-13 02:09:26.577303+0000","2013-02-12 23:45:16.153144+0000","818","1","3","","a rectangular orange object","close to the middle of the table, a bit near the right side.","f"
"4091","2012-12-13 02:12:29.163247+0000","2013-02-12 23:45:16.191385+0000","819","2","10","","a yellow cube about the size of a baseball","on the far end of the table behind two purple cubes.","f"
"4092","2012-12-13 02:12:29.175662+0000","2013-02-12 23:45:16.260705+0000","819","4","19","","a cylindrical flat object that is orange","near the middle of the table next to a red sphere.","f"
"4093","2012-12-13 02:12:29.184374+0000","2013-02-12 23:45:16.275245+0000","819","5","21","","a green box","adjacent to a small purple ball near the middle of the table.","f"
